<?xml version="1.0"?><Containers xmlns="urn:Schema-Namespace" xmlns:xsi="http://www.w3.org/2001/XMLSchema-instance" xsi:schemaLocation="urn:Schema-Namespace dataStructure.xsd "><Container ID="10849147913500"><ClientID>897841664500</ClientID><JourneyID>12708737599400</JourneyID><StartPortID>12708669367300</StartPortID><DestinationPortID>12708675509600</DestinationPortID><CurrentPosition><Latitude>26.11</Latitude><Longitude>74.33</Longitude></CurrentPosition><Cargo>snacks</Cargo><InternalState><Temperature>36.0</Temperature><Atmosphere>1.0</Atmosphere><Humidity>78.0</Humidity></InternalState><Updated>2020-04-16T15:12:12</Updated><ArriveBy>2020-06-23T12:00</ArriveBy></Container><Container ID="12708682651400"><ClientID>0</ClientID><JourneyID>12915057106300</JourneyID><StartPortID>12708669367300</StartPortID><DestinationPortID>12708675509600</DestinationPortID><CurrentPosition><Latitude>25.11</Latitude><Longitude>62.33</Longitude></CurrentPosition><Cargo>Mangoes</Cargo><InternalState><Temperature>10.0</Temperature><Atmosphere>1.0</Atmosphere><Humidity>90.0</Humidity></InternalState><Updated>2020-04-16T15:15:38</Updated><ArriveBy>2020-04-16T15:15:38</ArriveBy></Container><Container ID="12708736180700"><ClientID>0</ClientID><JourneyID>12819232224900</JourneyID><StartPortID>12708669367300</StartPortID><DestinationPortID>12708675509600</DestinationPortID><CurrentPosition><Latitude>25.11</Latitude><Longitude>62.33</Longitude></CurrentPosition><Cargo>Mangoes</Cargo><InternalState><Temperature>10.0</Temperature><Atmosphere>1.0</Atmosphere><Humidity>90.0</Humidity></InternalState><Updated>2020-04-16T15:14:03</Updated><ArriveBy>2020-04-16T15:14:03</ArriveBy></Container><Container ID="12708736452900"><ClientID>0</ClientID><JourneyID>12792237656500</JourneyID><StartPortID>12708669367300</StartPortID><DestinationPortID>12708675509600</DestinationPortID><CurrentPosition><Latitude>25.11</Latitude><Longitude>62.33</Longitude></CurrentPosition><Cargo>Mangoes</Cargo><InternalState><Temperature>10.0</Temperature><Atmosphere>1.0</Atmosphere><Humidity>90.0</Humidity></InternalState><Updated>2020-04-16T15:13:36</Updated><ArriveBy>2020-04-16T15:13:36</ArriveBy></Container><Container ID="12708736625200"><ClientID>0</ClientID><JourneyID>12723422024300</JourneyID><StartPortID>12708669367300</StartPortID><DestinationPortID>12708675509600</DestinationPortID><CurrentPosition><Latitude>25.11</Latitude><Longitude>62.33</Longitude></CurrentPosition><Cargo>Mangoes</Cargo><InternalState><Temperature>10.0</Temperature><Atmosphere>1.0</Atmosphere><Humidity>90.0</Humidity></InternalState><Updated>2020-04-16T15:12:27</Updated><ArriveBy>2020-04-16T15:12:27</ArriveBy></Container><Container ID="12708736872800"><ClientID>0</ClientID><JourneyID>0</JourneyID><StartPortID>12708675509600</StartPortID><DestinationPortID>12708675509600</DestinationPortID><CurrentPosition><Latitude>55.7</Latitude><Longitude>12.59</Longitude></CurrentPosition><Cargo>none</Cargo><InternalState><Temperature>35.0</Temperature><Atmosphere>1.0</Atmosphere><Humidity>75.0</Humidity></InternalState><Updated>2020-04-16T15:12:12</Updated><ArriveBy>2020-04-16T15:12:12</ArriveBy></Container><Container ID="12708737034600"><ClientID>0</ClientID><JourneyID>0</JourneyID><StartPortID>12708675509600</StartPortID><DestinationPortID>12708675509600</DestinationPortID><CurrentPosition><Latitude>55.7</Latitude><Longitude>12.59</Longitude></CurrentPosition><Cargo>none</Cargo><InternalState><Temperature>35.0</Temperature><Atmosphere>1.0</Atmosphere><Humidity>75.0</Humidity></InternalState><Updated>2020-04-16T15:12:12</Updated><ArriveBy>2020-04-16T15:12:12</ArriveBy></Container><Container ID="12985485931900"><ClientID>0</ClientID><JourneyID>12985866966400</JourneyID><StartPortID>12708669367300</StartPortID><DestinationPortID>12708675509600</DestinationPortID><CurrentPosition><Latitude>25.11</Latitude><Longitude>62.33</Longitude></CurrentPosition><Cargo>Mangoes</Cargo><InternalState><Temperature>10.0</Temperature><Atmosphere>1.0</Atmosphere><Humidity>90.0</Humidity></InternalState><Updated>2020-04-16T15:16:49</Updated><ArriveBy>2020-04-16T15:16:49</ArriveBy></Container><Container ID="13635886882300"><ClientID>0</ClientID><JourneyID>13636014112800</JourneyID><StartPortID>12708669367300</StartPortID><DestinationPortID>12708675509600</DestinationPortID><CurrentPosition><Latitude>25.11</Latitude><Longitude>62.33</Longitude></CurrentPosition><Cargo>Mangoes</Cargo><InternalState><Temperature>10.0</Temperature><Atmosphere>1.0</Atmosphere><Humidity>90.0</Humidity></InternalState><Updated>2020-04-16T15:27:39</Updated><ArriveBy>2020-04-16T15:27:39</ArriveBy></Container><Container ID="13678821291400"><ClientID>0</ClientID><JourneyID>13679009012900</JourneyID><StartPortID>12708669367300</StartPortID><DestinationPortID>12708675509600</DestinationPortID><CurrentPosition><Latitude>25.11</Latitude><Longitude>62.33</Longitude></CurrentPosition><Cargo>Mangoes</Cargo><InternalState><Temperature>10.0</Temperature><Atmosphere>1.0</Atmosphere><Humidity>90.0</Humidity></InternalState><Updated>2020-04-16T15:28:22</Updated><ArriveBy>2020-04-16T15:28:22</ArriveBy></Container><Container ID="13778387788600"><ClientID>0</ClientID><JourneyID>13778607452800</JourneyID><StartPortID>12708669367300</StartPortID><DestinationPortID>12708675509600</DestinationPortID><CurrentPosition><Latitude>25.11</Latitude><Longitude>62.33</Longitude></CurrentPosition><Cargo>Mangoes</Cargo><InternalState><Temperature>10.0</Temperature><Atmosphere>1.0</Atmosphere><Humidity>90.0</Humidity></InternalState><Updated>2020-04-16T15:30:02</Updated><ArriveBy>2020-04-16T15:30:02</ArriveBy></Container><Container ID="73013416799200"><ClientID>0</ClientID><JourneyID>0</JourneyID><StartPortID>12708675509600</StartPortID><DestinationPortID>12708675509600</DestinationPortID><CurrentPosition><Latitude>55.7</Latitude><Longitude>12.59</Longitude></CurrentPosition><Cargo>none</Cargo><InternalState><Temperature>35.0</Temperature><Atmosphere>1.0</Atmosphere><Humidity>75.0</Humidity></InternalState><Updated>2020-04-16T15:12:12</Updated><ArriveBy>2020-04-16T15:12:12</ArriveBy></Container><Container ID="521664805370600"><ClientID>0</ClientID><JourneyID>0</JourneyID><StartPortID>12708675509600</StartPortID><DestinationPortID>12708675509600</DestinationPortID><CurrentPosition><Latitude>55.7</Latitude><Longitude>12.59</Longitude></CurrentPosition><Cargo>none</Cargo><InternalState><Temperature>35.0</Temperature><Atmosphere>1.0</Atmosphere><Humidity>75.0</Humidity></InternalState><Updated>2020-04-16T15:12:12</Updated><ArriveBy>2020-04-16T15:12:12</ArriveBy></Container></Containers>