<?xml version="1.0" encoding="UTF-8"?>
<History xmlns="urn:Schema-Namespace" xmlns:xsi="http://www.w3.org/2001/XMLSchema-instance" xsi:schemaLocation="urn:Schema-Namespace dataStructure.xsd ">
  <DataPoint>
    <TimeStamp>2001-12-31T12:00:00</TimeStamp>
    <ContainerID>0</ContainerID>
    <JourneyID>0</JourneyID>
    <ClientID>0</ClientID>
    <DestinationPortID>0</DestinationPortID>
    <StartPortID>0</StartPortID>
    <Cargo>Cargo</Cargo>
    <InternalState>
      <Temperature>0.0</Temperature>
      <Atmosphere>0.0</Atmosphere>
      <Humidity>0.0</Humidity>
    </InternalState>
    <Location>
      <Latitude>0.0</Latitude>
      <Longitude>0.0</Longitude>
    </Location>
  </DataPoint>
</History>
